<?xml version="1.0" encoding="UTF-8"?>
<env:synthetic_environment 
    xmlns:c="http://persephone.gallowdd.pitt.edu/xml/common" 
    xmlns:env="http://persephone.gallowdd.pitt.edu/xml/synthenv" 
    xmlns:xsi="http://www.w3.org/2001/XMLSchema-instance" 
    xsi:schemaLocation="http://persephone.gallowdd.pitt.edu/xml/synthenv schema/persephoneSyntheticEnvironment.xsd">
    <env:identifier>01003</env:identifier>
    <env:country>USA</env:country>
    <env:version>Persephone.v1.0</env:version>
    <env:agent>
        <env:agent_type>Person</env:agent_type>
        <env:filename>people.csv</env:filename>
        <env:entry_count>9227</env:entry_count>
    </env:agent>
    <env:agent>
        <env:agent_type>Person</env:agent_type>
        <env:filename>gq_people.csv</env:filename>
        <env:entry_count>1642</env:entry_count>
    </env:agent>
    <env:location>
        <env:location_type>Household</env:location_type>
        <env:filename>households.csv</env:filename>
        <env:entry_count>3745</env:entry_count>
    </env:location>
    <env:location>
        <env:location_type>School</env:location_type>
        <env:filename>schools.csv</env:filename>
        <env:entry_count>9</env:entry_count>
    </env:location>
    <env:location>
        <env:location_type>Workplace</env:location_type>
        <env:filename>workplaces.csv</env:filename>
        <env:entry_count>1356</env:entry_count>
    </env:location>
    <env:location>
        <env:location_type>CollegeDorm</env:location_type>
        <env:filename>college_dorms.csv</env:filename>
        <env:entry_count>0</env:entry_count>
    </env:location>
    <env:location>
        <env:location_type>NursingFacility</env:location_type>
        <env:filename>nursing_facilities.csv</env:filename>
        <env:entry_count>1</env:entry_count>
    </env:location>
    <env:location>
        <env:location_type>Prison</env:location_type>
        <env:filename>prisons.csv</env:filename>
        <env:entry_count>3</env:entry_count>
    </env:location>
    <env:location>
        <env:location_type>MilitaryBarracks</env:location_type>
        <env:filename>military_barracks.csv</env:filename>
        <env:entry_count>0</env:entry_count>
    </env:location>
</env:synthetic_environment>
